{
  "schema_version": "1.0",
  "kind": "task",
  "id": "B023",
  "scope": "task_checks_only",
  "spec_version": "1.1",
  "economic_baseline": "1.0",
  "interface_version": "risk-integration-1",
  "recorded_at": "2026-10-04T20:17:32.833814+00:00",
  "source_commit": "0ff2b69e4cdf65a182b76dc7a2adac23ba77112d",
  "worktree_dirty": true,
  "toolchain": {
    "python": "3.12.10",
    "forge": "forge Version: 1.8.3\nCommit SHA: cae51ad458f6abb64852b7709eb784352429825d\nBuild Timestamp: 2026-09-15T10:30:41.249604900Z (1789468241)\nBuild Profile: dist",
    "solc_declared": "0.8.30",
    "foundry_profile": "risk",
    "dependency_status": "f3dae6e6ee381f25eb6a246f7da9b85c91a68219 contracts/lib/forge-std (v1.17.0)\n 2afba69bf67b78dd4abeadcc696052b3a6f71499 contracts/lib/solady (v0.1.26-36-g2afba69b)\n f3dae6e6ee381f25eb6a246f7da9b85c91a68219 oracle/lib/forge-std (v1.17.0)\n dc44c9f1a4c3b10af99492eed84f83ed244203f6 oracle/lib/openzeppelin-contracts-v4 (v4.9.5-2-gdc44c9f1)\n 2afba69bf67b78dd4abeadcc696052b3a6f71499 oracle/lib/solady (v0.1.26-36-g2afba69)\n d1a2373e2e0a3cbb28bce48ca72379a2abb97c69 oracle/lib/uma-protocol (heads/master)"
  },
  "seed": "0x45524f53",
  "python_hash_seed": "0",
  "fixture_hashes": {
    "reference/common/result_schema.json": "cc529a8f7cb685dc9133cb9ac5589b016884d8cf7a7fadb90cc516f40c835542",
    "reference/common/units.py": "bc102b4a360eda89c20ceda04a9860f1d238421e326e75d79d53b8217cc1948e",
    "reference/fixtures/a/vectors.json": "032112c0c9c0de733ac31f18bacf3f72856a8c65bc4ea3a5dc83820d6554d5a7",
    "reference/fixtures/golden_cases.json": "68ce2f302fa7f2cac181185ed9fbb18ae454e4c28c4020d56b4df28860ee988d",
    "reference/a/coverage.py": "f0fe210e837e965bde33656186f049f31d8568ef7c5e30fa882547b6f8e90a4b",
    "reference/a/export_vectors.py": "b122fd8c390dd73f5437080fb5c0ea688ad839098dc505d145f698afcea42c3e",
    "reference/a/funding.py": "d03ba9f55ff4c3289355455e357bb10e8c87de51971aefed2e4c5e00d7d8d4ae",
    "reference/a/integer_bounds.py": "64676f77ec44a939ce167cf74ab2c913a4da7b108eff1cd8ddf01b5ed2db3a23",
    "reference/a/integrated_traces.py": "54bbd8a6b7ae3ed1a2db236eab97d70dfa276ac124099bfc77c2d041114d1411",
    "reference/a/ledger.py": "142effd55e196b813d82bd7a2b375822a7b88243baca4d466ccfbbba908ff604",
    "reference/a/premium_epochs.py": "7619b27491926e4bf99703bddc22ccd4a1d26d4e0f500080b549af5c92aeeff7",
    "reference/a/premium_integral.py": "2a7346f637e2ace46790ad8517c28aa020ea962917afe698df2d933770d2464c",
    "reference/a/settlement.py": "2e2f3f01678bbb6ebf1ab0bd790770f9a7b36d0a671c70aff830e7159ed7876c",
    "contracts/src/math/CoverageMath.sol": "23c32f10c027aca472c2b3f6cb5d46914df95395c78ca1ddebb28243026fea00",
    "contracts/src/math/FeeMath.sol": "c0231e5bdc3467376fec4853901ddecf4d2398236eac146c931ae45cde6a3c28",
    "contracts/src/math/FundingMath.sol": "8c9a02150ef5afded3b37fed9f60e11fe5345e516d43f52382811f0c33283490",
    "contracts/src/math/HazardMath.sol": "598ae70135a29f2f8a1b31bf0c84c12dc368ba0515ff3900ec6e47562c7b6402",
    "contracts/src/math/HorizonMath.sol": "defb79573d03e3e83ae2d9c977fb7c7f58aa60bde0b2c4d853f48761f863953e",
    "contracts/src/math/LedgerMath.sol": "e90f6ef42361f2cf655e9feac0e23583f5033f02e6e6d0e3625a4f6f41e8661f",
    "contracts/src/math/LifecycleMath.sol": "c03b594ec51a47b92fffbc75db1d2f3898d0a6a55062c054c0ec9ea3412dacd2",
    "contracts/src/math/LiquidationMath.sol": "98fafbc734e76511ae0f71723ebed4f78ac3395dcbcbe0ec92fafe80e8f2341c",
    "contracts/src/math/MarginMath.sol": "3fbd6953e3b5236cd502584c665ac4bf1fef126f5e71269f7725de8188b65933",
    "contracts/src/math/MathTypes.sol": "61b7608677a9c908f2aebe74d01268bdb645705fbeef3f60baa89218b11292be",
    "contracts/src/math/OrderAdmissionMath.sol": "15a354f6753163bcb9250b55d6ce249b50255825ed9b2d8d1310d8d07388dbef",
    "contracts/src/math/PremiumMath.sol": "bc0678ca38cb800cccd4b4de92d66f9381d070a0cec76d1415494b27540c29ba",
    "contracts/src/math/PricingMath.sol": "c578f06c1b083a23885b548d64d5fee781b7ec9782b6bfba4e1780674f65f441",
    "contracts/src/math/QMath.sol": "c6def1e6822738ad859ef62fcd0d714d2afa49c3e5ed104927f676f770b9306d",
    "contracts/src/math/RiskTypes.sol": "55dc1ca725fcbcedad9b442ef6f1ab5950ddc16aacc2f6079e934f1b07ea3a59",
    "contracts/src/math/SettlementMath.sol": "b7045385617f0517cbcdb3f3a13c9e13e1ebee55bc3dbe14827762e26944e426",
    "contracts/src/risk/Accounting.sol": "ccfee47b1fbaa1ce9ebcbe2667d95c72b7b1260672f99da69d79b6a7ceb47669",
    "contracts/src/risk/AccountingEvents.sol": "d2c35d54e156b6bead1a1253b5eef4b3e81e80da95b973309bd80c72f97458b0",
    "contracts/src/risk/AccountingPort.sol": "d032394d4cb751bc53ff02ec01f26c8642518731599694dfaf987772fc7bdd75",
    "contracts/src/risk/AccountRegistry.sol": "84bcf575a2647574a70ff45c3a9d40f8ca5fc76c324f38b837acffd8eedf4bd5",
    "contracts/src/risk/AccountSync.sol": "6393a4e4c01c2bf0aed549bcc51374e728e485fdd576fb853dc20f7604ec82b7",
    "contracts/src/risk/BookRiskAdapter.sol": "bead045884a13101dca4c3d9ad567d8c91bc74b000d2acd273485d5a16e3465a",
    "contracts/src/risk/ClearingCore.sol": "9c9409d7739be643e09d8a2ed46147a0517cd21a0010bdada47b407753a14227",
    "contracts/src/risk/EpochRollover.sol": "342c07ecab3ba5d2f39964b24d113cfd4410a0ae09fe15a958b62e28d7eb5bf6",
    "contracts/src/risk/FeeAccounting.sol": "060d0779bde1626871d17d1a3396e5987733fedf82c3ff3a2968c847a8c6831c",
    "contracts/src/risk/FloorAccounting.sol": "cd7c593be273da3169fd88ec048ee84daaa79364e34ccfd2c3733d1ea849c5d9",
    "contracts/src/risk/FloorLifecycle.sol": "e50cf167c69dcad9b11782632c955cc4e2119e44805c9824de2a302aa6ccadfb",
    "contracts/src/risk/FreezeAccounting.sol": "2bcc8d93158cd655d90650312da60870cf87489d2f33b080a6ff2a1ce6bca78a",
    "contracts/src/risk/FundingAccounting.sol": "585b27b0188a876c6b017ace217e0c14a22d2402d88d6c1cfb3db3d8ec84d702",
    "contracts/src/risk/LiquidationBookAdapter.sol": "fffde22ee62b00341f4e93f2945990ac004e186f9d8905f8c91dfc3a47165f08",
    "contracts/src/risk/LiquidationEligibility.sol": "32c3bd4f30bd8d5a9c89e09ce7c70b216ab64b1839c9f17952a9dc16278fa74e",
    "contracts/src/risk/LiquidationFees.sol": "952a377e55c5857130513b36be5315086490b5176762f2d71668db4fa0745398",
    "contracts/src/risk/MonitorPolicy.sol": "0c21dcad6379ee76679a74238b996ff1ddd88246bf949d5034013a60f6bb3572",
    "contracts/src/risk/OrderAdmission.sol": "ce9e87cdd3b12d54b1375f2740f32356f5a9d7f53ef8f655fafa3d2a9d28930b",
    "contracts/src/risk/OrderLifecycle.sol": "2ce913ef397bb5486e1ac08091ca75ce43a944ed7f33a3b8044cd1f43c458f0f",
    "contracts/src/risk/OrderRisk.sol": "8167f5470e2766968e26375de3eba39a1d987823b1bbdc84fb0c8a28b2398281",
    "contracts/src/risk/PremiumAccounting.sol": "7681f7fb0f5a7fd7cd219ed9c5179a175011b1dd05c4311c44f936023fa5ff29",
    "contracts/src/risk/ReserveAccounting.sol": "5da803993cbb1f1cb6f91e2dc63bf9aaa6bf6b83aff5dffa9876a8f92e1f850c",
    "contracts/src/risk/RiskContextPort.sol": "680bc1c29a04ec1a3b822e82a4cf74dfea03d2b3cb4bc76616fe310bd15829a0",
    "contracts/src/risk/RiskLifecycle.sol": "54a8c0fe36c514790558287eae9b9ac1f00b02b62b41691d87b9291761f8da23",
    "contracts/src/risk/RiskLiquidation.sol": "1e91a6ea2d2577c534ef263632e215f733925082afdcfb927282e47638859829",
    "contracts/src/risk/RiskStorage.sol": "82bdf7df55df3d55fe9a65472062fd420b9983664fb8d54133fc0d7d8f50b479",
    "contracts/src/risk/RiskView.sol": "03f804d793f09b67a689e630c302a2569c7b23a9dda38cce1ce1ecfa633841ee",
    "contracts/src/risk/TakeoverAccounting.sol": "91cda0e7e7048b73ed25c1023ef3ffcacbb74397540eb494b27783249a782fb9",
    "contracts/src/risk/TradePreview.sol": "e8ea4eaf7d7816cdb684c0ec8d1602da046673fb6ffeba9847fcdc3347121a97",
    "contracts/src/vaults/BackstopPool.sol": "9feef5ed2514a9f6ec8c04a1d98a3e652a8ab2db8318dc1cb6ffb59e63fa9c1b",
    "contracts/src/vaults/CollateralVault.sol": "2777165e1316770db31fdfabb245b970d170007195660fd39bc11db136e4af14",
    "contracts/src/vaults/ReserveVault.sol": "3e01c19c66e5955abfce2e1f2ae3a899a47b65d3f55b4af179fb754d935e454d",
    "contracts/src/settlement/ClaimEscrow.sol": "38226ea4e5c701e951478438e0490c097c1f3131ca500df62d5b2ff0531834ef",
    "contracts/src/settlement/ConversionGate.sol": "ea2c8f1510b66466f28510ef5784914f1d8ab5bee371d1cd05660a9acd898608",
    "contracts/src/settlement/InvalidPrice.sol": "1239fa47462fb95aa8981f206d118ad1355658367e0db65201357775e16017c2",
    "contracts/src/settlement/PayoutLedger.sol": "51ffda681f1bd90b36b25fde2b35e6a564774c742a467c407d154d8e76b17730",
    "contracts/src/settlement/RecoveryAccounting.sol": "d6a3af6eaf2c10dd0df8ed7a7c76770301f55703793a72a26b8b4e59ec5725ed",
    "contracts/src/settlement/ReserveClaims.sol": "7acdd5a78a34e101a77c3dfe22a113d062a1758affaa1e19cf1e65c5db7c8b29",
    "contracts/src/settlement/ResolutionIngress.sol": "78b94841433e8ffcc15b055ae2416c3570191bba44d0e41d94a3141599030a85",
    "contracts/src/settlement/SettlementController.sol": "16828c0f5327c133dd6d87c978ceba35f4513f3438c3e68cea2ed2832d29d43c",
    "contracts/src/settlement/SnapshotLedger.sol": "1d1f83965bd940582a16bb48e2def20042d4208c210e43537cce78e4de225c56",
    "contracts/test/harness/A/AccountingHarness.sol": "65d3f9c696a9861fc3e4a912c48d3915eff82a822b6b21f54878c641d1702b53",
    "contracts/test/mocks/A/MockRiskDecision.sol": "f16e9551d98b85a831f7047092626b5651f7bfd690d0d255671b96f744be4659",
    "contracts/test/mocks/A/MockUSDC.sol": "8e2266c0b85958f92b32d3ef4c37cef7ebec26eae1444cd66c886c090c913ad5",
    "contracts/test/risk/A/A016.t.sol": "50318df96defa61e55c8e0c6f0a64104aa4ce374dee3ddff9afa3ee8fc9a137d",
    "contracts/test/risk/A/A017.t.sol": "6843ccf139d7aa4b8a20f1ff4fc50ef05549a8af4b1b22c156f8ee2a453fffe8",
    "contracts/test/risk/A/A018.t.sol": "436c87d6c16b0770ea0727a3baf1a89489ed48462d328ac5b5cf45239395b973",
    "contracts/test/risk/A/A019.t.sol": "6884d493f86c2af8fcc6c99aafd76f16a9ede3050096c8e34548d0c928521d31",
    "contracts/test/risk/A/A020.t.sol": "87842571777264c365aec48b133bb3138aecd57e82b78af4c449455e858539ea",